{
  "schemaVersion": 1,
  "meta": {
    "title": "Babylon.js, an illustrative 9.x cycle",
    "period": "9.x cycle",
    "exportedAt": "2026-09-14T00:00:00Z",
    "generator": "hand-authored"
  },
  "company": {
    "name": "Babylon.js",
    "units": [
      {
        "id": "maintainers",
        "name": "Maintainers",
        "parent": null,
        "charter": {
          "mission": "We keep the release train running and decide what 9.x is, so that every package team can ship without negotiating a date with every other package team.",
          "process": "Scope proposals come in from the package teams and from the forum. We publish the 9.x scope once, cut a release on a fixed cadence, and hold a weekly maintainers call where anything that changes another package's public API is argued and decided there rather than in a pull request thread. A breaking change ships only with a migration note and a deprecation that has already been through a release.",
          "owns": [
            "the release train",
            "the 9.x scope",
            "the breaking-change policy",
            "the deprecation list"
          ]
        }
      },
      {
        "id": "core",
        "name": "Engine core",
        "parent": "maintainers",
        "charter": {
          "mission": "We are the engine everything else is built on: if a scene renders at all, it renders through us.",
          "process": "Feature requests arrive from the package teams and bug reports arrive already labelled and routed from triage. We work against the visual test suite \u2014 a change that moves a reference image does not merge until the diff is explained \u2014 and we land WebGL and WebGPU behind one public API so no caller has to know which backend is under it.",
          "owns": [
            "the scene graph",
            "the WebGL and WebGPU backends",
            "the animation system",
            "the material and mesh base classes",
            "the public API surface"
          ],
          "dependsOn": [
            "triage",
            "build-tools"
          ]
        }
      },
      {
        "id": "loaders",
        "name": "Loaders & serializers",
        "parent": "maintainers",
        "charter": {
          "mission": "We make sure an asset that leaves any authoring tool arrives in a Babylon scene looking the way its author meant it to.",
          "process": "New extensions come from the Khronos registry and broken-asset reports come from triage. Every extension lands with a sample asset in the conformance suite and a reference render; export is tested by round-tripping the same asset back out and comparing it against that render. An asset we cannot load is a bug against us even when the exporter that wrote it is the thing that is wrong.",
          "owns": [
            "glTF import and export",
            "the OBJ, STL and SPLAT loaders",
            "the glTF extension registry",
            "the asset conformance suite"
          ],
          "dependsOn": [
            "core",
            "triage"
          ]
        }
      },
      {
        "id": "materials",
        "name": "Materials & post-processes",
        "parent": "maintainers",
        "charter": {
          "mission": "We give a scene its look: the shading, the textures and the post-processing that turn correct geometry into something worth showing.",
          "process": "We build on core's material base classes rather than beside them. Every material and post-process in the library ships with a Playground that demonstrates it and a reference image in the visual suite, and anything that moves that image is reverted before the release rather than explained after it.",
          "owns": [
            "the materials library",
            "the procedural textures",
            "the post-process pipeline",
            "the shader include library"
          ],
          "dependsOn": [
            "core",
            "triage"
          ]
        }
      },
      {
        "id": "gui",
        "name": "GUI",
        "parent": "maintainers",
        "charter": {
          "mission": "We are how a scene talks back to the person looking at it, in 2D over the canvas and in 3D inside it.",
          "process": "Control requests come from the viewer, the editors and the forum, routed to us by triage. We keep the control set small and composable, ship each control in both the 2D and the 3D flavour where that makes sense, and hold the GUI editor to one rule: anything you can build by hand you can build in the editor, and it serializes to the same file either way.",
          "owns": [
            "the 2D GUI controls",
            "the 3D GUI controls",
            "the GUI editor",
            "the GUI serialization format"
          ],
          "dependsOn": [
            "core",
            "triage"
          ]
        }
      },
      {
        "id": "node-editors",
        "name": "Node editors",
        "parent": "maintainers",
        "charter": {
          "mission": "We let someone build a material, a geometry, a particle system or a render graph by wiring boxes together, so that writing shader code stops being the price of entry.",
          "process": "New blocks follow new core and materials features by one release: they land the capability, we expose it as a block with a live preview and a saved snippet. The four editors share one graph canvas and one serialization layer, so a fix to the canvas lands in all of them at once and a graph saved by one of them is readable by the others.",
          "owns": [
            "the node material editor",
            "the node geometry editor",
            "the node particle editor",
            "the node render graph editor",
            "the shared node graph canvas"
          ],
          "dependsOn": [
            "core",
            "materials",
            "triage"
          ]
        }
      },
      {
        "id": "inspector",
        "name": "Inspector",
        "parent": "maintainers",
        "charter": {
          "mission": "We make a running scene legible: what is in it, what it is doing, and which property is the one that is wrong.",
          "process": "We follow the core API \u2014 a new property that is not in the inspector is a bug against us, not against core. Inspector v2 is built on the shared UI component library and lands feature by feature alongside v1 until it can replace it; we do not ship a v2 that can do less than the v1 it replaces.",
          "owns": [
            "inspector v1 and v2",
            "the shared UI component library",
            "the scene explorer and the property grid"
          ],
          "dependsOn": [
            "core",
            "triage"
          ]
        }
      },
      {
        "id": "playground",
        "name": "Playground & sandbox",
        "parent": "maintainers",
        "charter": {
          "mission": "We are where every bug is reproduced and every feature is learned: a scene anyone can open, edit and share by link in under ten seconds.",
          "process": "Every release becomes a selectable version in the playground on the day it is tagged. Snippets are immutable once saved and are never collected, because a five-year-old forum post linking to one is the documentation for that answer. The sandbox does the same job for a file someone drags in rather than code they type.",
          "owns": [
            "the playground",
            "the sandbox",
            "the snippet server",
            "the example library"
          ],
          "dependsOn": [
            "core",
            "inspector",
            "triage"
          ]
        }
      },
      {
        "id": "viewer",
        "name": "Viewer",
        "parent": "maintainers",
        "charter": {
          "mission": "We make putting a 3D model on a web page a one-line job for someone who has never heard of a scene graph.",
          "process": "We wrap the engine in a web component with a declarative configuration and no required JavaScript. Every configurator option maps to an attribute and every attribute is documented, and we hold the whole bundle to a size budget, because the people who use us are putting it on a product page that has a budget of its own.",
          "owns": [
            "the viewer web component",
            "the viewer configurator",
            "the viewer bundle size budget"
          ],
          "dependsOn": [
            "core",
            "loaders",
            "gui",
            "triage"
          ]
        }
      },
      {
        "id": "smart-filters",
        "name": "Smart Filters",
        "parent": "maintainers",
        "charter": {
          "mission": "We make real-time video and image effects composable, so an effect chain is something you assemble rather than something you write.",
          "process": "Filters are authored as blocks in the smart filter editor and compiled down to one optimised shader per chain. We take the node editors' canvas as given and contribute back to it rather than forking it, and every block ships with a demo chain that runs against a live camera feed so a regression is visible rather than reported.",
          "owns": [
            "the smart filter runtime",
            "the smart filter block library",
            "the smart filter editor"
          ],
          "dependsOn": [
            "core",
            "node-editors",
            "triage"
          ]
        }
      },
      {
        "id": "native",
        "name": "Babylon Native",
        "parent": "maintainers",
        "charter": {
          "mission": "We run the same scene, unchanged, outside a browser \u2014 in a native app, on a phone, and under React Native.",